{
    "$schema": "https://json-schema.org/draft/2020-12/schema",
    "title": "RoboCasa Benchmark Submission",
    "type": "object",
    "required": [
      "model_name",
      "model_type",
      "date",
      "robocasa_version",
      "atomic_seen_success",
      "composite_seen_success",
      "composite_unseen_success",
      "paper_link",
      "open_source",
      "training_config",
      "notes"
    ],
    "if": {
      "properties": {
        "open_source": {
          "const": "yes"
        }
      }
    },
    "then": {
      "required": [
        "code_url",
        "commit_hash",
        "checkpoint_url"
      ]
    },
    "properties": {
      "model_name": {
        "type": "string",
        "minLength": 1
      },
      "model_type": {
        "type": "string",
        "enum": ["VLA", "WAM", "VLA + WM", "Visuomotor", "Other"]
      },
      "submitter": {
        "type": "string",
        "minLength": 1
      },
      "submitter_url": {
        "type": "string",
        "minLength": 1
      },
      "date": {
        "type": "string",
        "format": "date"
      },
      "robocasa_version": {
        "type": "string",
        "minLength": 1
      },
      "atomic_seen_success": {
        "type": "number",
        "minimum": 0,
        "maximum": 100
      },
      "composite_seen_success": {
        "type": "number",
        "minimum": 0,
        "maximum": 100
      },
      "composite_unseen_success": {
        "type": "number",
        "minimum": 0,
        "maximum": 100
      },
      "code_url": {
        "type": "string",
        "minLength": 1
      },
      "commit_hash": {
        "type": "string",
        "minLength": 1
      },
      "checkpoint_url": {
        "type": "string",
        "minLength": 1
      },
      "paper_link": {
        "type": "string",
        "minLength": 1
      },
      "open_source": {
        "type": "string",
        "enum": ["yes", "no"]
      },
      "wandb": {
        "type": "string",
        "minLength": 1
      },
      "training_config": {
        "type": "object",
        "required": [
          "batch_size",
          "num_training_steps"
        ],
        "properties": {
          "batch_size": {
            "type": "integer",
            "minimum": 1
          },
          "num_training_steps": {
            "type": "integer",
            "minimum": 1
          }
        },
        "additionalProperties": false
      },
      "notes": {
        "type": "string",
        "minLength": 1
      }
    },
    "additionalProperties": false
  }
