{
    "model_name": "Diffusion Policy",
    "model_type": "Visuomotor",
    "submitter": "RoboCasa Team",
    "date": "2026-04-02",
    "robocasa_version": "1.0.0",
    "atomic_seen_success": 15.7,
    "composite_seen_success": 0.2,
    "composite_unseen_success": 1.3,
    "code_url": "https://github.com/robocasa-benchmark/diffusion_policy",
    "commit_hash": "da6996f475572a3e37da16fef27b375732a612b4",
    "checkpoint_url": "https://huggingface.co/robocasa/robocasa365_checkpoints/blob/main/diffusion_policy/17.40.09_train_diffusion_transformer_hybrid_pretrain_human300/checkpoints/epoch%3D0500-test_mean_score%3D-1.000.ckpt",
    "paper_link": "https://arxiv.org/abs/2303.04137",
    "open_source": "yes",
    "training_config": {
        "batch_size": 192,
        "num_training_steps": 250000
    },
    "notes": "Example submission file."
  }