{
  "model_name": "Azero-Robotics-1",
  "submitter": "GitHub: yuxin101",
  "model_type": "VLA",
  "submitter_url": "https://github.com/robocasa-benchmark/leaderboard/pull/11",
  "date": "2026-08-17",
  "robocasa_version": "1.0.1",
  "atomic_seen_success": 30.3,
  "composite_seen_success": 3.8,
  "composite_unseen_success": 1.6,
  "code_url": "https://github.com/soundai2016/Azero-Robotics-1-Robocasa365",
  "commit_hash": "82ccf2b164ed604185599e490c968048ec5b4ee2",
  "checkpoint_url": "https://huggingface.co/soundai2016/Azero-Robotics-1-RoboCasa365/tree/main",
  "paper_link": "N/A",
  "open_source": "no",
  "wandb": "https://wandb.ai/yuxin-soundai-soundai/robocasa365/runs/7711y2ka",
  "training_config": {
    "batch_size": 128,
    "num_training_steps": 120000
  },
  "notes": "Azero-Robotics-1 is initialized from the publicly released NVIDIA GR00T-N1.5-3B checkpoint and retrained under the official RoboCasa365 multi-task learning protocol using pretrain_human300. Results are from a completed 50-task formal eval run. The reported training_config.batch_size is the global batch size (128), corresponding to a per-GPU batch size of 16 over 8 GPUs. Code and checkpoint are hosted as linked above, and private verification access can be granted to the RoboCasa team if needed."
}
