{
  "model_name": "ABot-M0.6",
  "model_type": "VLA",
  "submitter": "AMAP CV Lab",
  "date": "2026-06-26",
  "robocasa_version": "1.0.1",
  "atomic_seen_success": 79.4,
  "composite_seen_success": 48.3, 
  "composite_unseen_success": 7.9,
  "paper_link": "https://arxiv.org/abs/2602.11236",
  "open_source": "no",
  "wandb": "https://wandb.ai/abot_m/ABot-M0.6/runs/xkphuvi2?nw=nwuserabot_m666",
  "training_config": {
    "batch_size": 256,
    "num_training_steps": 120000
  },
  "notes": "Results of ABot-M0.6. Evaluated by RoboCasa team with private access to model weights and code."
}

