{
    "model_name": "ABot-M0.5",
    "model_type": "WAM",
    "submitter": "AMAP CV Lab",
    "date": "2026-06-29",
    "robocasa_version": "1.0.1",
    "atomic_seen_success": 75.6,
    "composite_seen_success": 37.7, 
    "composite_unseen_success": 3.3,
    "code_url": "https://github.com/amap-cvlab/ABot-Manipulation",
    "commit_hash": "7642747ed2817b241dde5df06e17ee80192718ad",
    "checkpoint_url": "https://huggingface.co/acvlab/ABot-M0.5-RoboCasa365",
    "paper_link": "https://arxiv.org/abs/2607.00678",
    "open_source": "yes",
    "training_config": {
      "batch_size": 64,
      "num_training_steps": 100000
    },
    "notes": "Results of ABot-M0.5. Evaluated by RoboCasa team with private access to model weights and code."
  }
  
  
