{
    "model_name": "π0",
    "submitter": "RoboCasa Team",
    "model_type": "VLA",
    "date": "2026-04-02",
    "robocasa_version": "1.0.0",
    "atomic_seen_success": 34.6,
    "composite_seen_success": 6.1,
    "composite_unseen_success": 1.1,
    "code_url": "https://github.com/robocasa-benchmark/openpi",
    "commit_hash": "43fd9da0bdad94a2d409f5601b4b878f5ca59070",
    "checkpoint_url": "https://huggingface.co/robocasa/robocasa365_checkpoints/tree/main/pi0/pi0_robocasa_pretrain_human300/multitask_learning/75000",
    "paper_link": "https://arxiv.org/abs/2410.24164",
    "open_source": "yes",
    "wandb": "https://wandb.ai/snasiriany/openpi/runs/lkype54o?nw=nwusersnasiriany",
    "training_config": {
        "batch_size": 64,
        "num_training_steps": 75000
    },
    "notes": "Example submission file."
  }