{
  "model_name": "RLDX-1",
  "submitter": "RLWRLD",
  "model_type": "VLA",
  "date": "2026-05-20",
  "robocasa_version": "1.0.1",
  "atomic_seen_success": 67.6,
  "composite_seen_success": 27.9,
  "composite_unseen_success": 8.5,
  "code_url": "https://github.com/RLWRLD/RLDX-1",
  "commit_hash": "ef05cd4ae634ff97d672d42275febbc0b92cc192",
  "checkpoint_url": "https://huggingface.co/RLWRLD/RLDX-1-FT-RC365",
  "paper_link": "https://arxiv.org/abs/2605.03269",
  "open_source": "yes",
  "wandb": "https://wandb.ai/happyhappy/rldx-robocasa365/runs/di3k54nm",
  "training_config": {
    "batch_size": 192,
    "num_training_steps": 250000
  },
  "notes": "RLDX-1 Tech Report: https://arxiv.org/abs/2605.03269. @happyhappy-jun @huiwon-jang @dongyoungkim-prog"
}
