{
  "model_name": "Paimon-0",
  "model_type": "VLA",
  "submitter": "Primotion",
  "date": "2026-09-11",
  "robocasa_version": "1.0.1",
  "atomic_seen_success": 79.3,
  "composite_seen_success": 55.8,
  "composite_unseen_success": 36.7,
  "code_url": "N/A",
  "commit_hash": "N/A",
  "checkpoint_url": "N/A",
  "paper_link": "N/A",
  "open_source": "no",
  "wandb": "N/A",
  "training_config": {
    "batch_size": 560,
    "num_training_steps": 150000
  },
  "notes": "Results of Primotion-Robocasa365."
}
