{
  "model_name": "WorldDreamer",
  "model_type": "WAM",
  "submitter": "World Agents",
  "date": "2026-06-20",
  "robocasa_version": "1.0.1",
  "atomic_seen_success": 66.3,
  "composite_seen_success": 26.7,
  "composite_unseen_success": 9.0,
  "code_url": "https://github.com/worldAgents-c/world_dreamer_server-robocasa365-multi_task/tree/main",
  "commit_hash": "f9ba61f0657ca79b864e3eac6ddd6ef3634b4645",
  "checkpoint_url": "https://huggingface.co/WorldAgents-c/world_dreamer-robocasa365-multi_task",
  "paper_link": "N/A",
  "open_source": "yes",
  "training_config": {
    "batch_size": 20,
    "num_training_steps": 375000
  },
  "notes": "Re-evaluated on pretrain split"
}
