{
  "model_name": "ProWAM",
  "submitter": "Meta",
  "model_type": "WAM",
  "date": "2026-09-30",
  "robocasa_version": "1.0.1",
  "atomic_seen_success": 76.0,
  "composite_seen_success": 46.5,
  "composite_unseen_success": 18.2,
  "code_url": "N/A",
  "commit_hash": "N/A",
  "checkpoint_url": "N/A",
  "paper_link": "https://arxiv.org/abs/2610.02508",
  "open_source": "no",
  "wandb": "N/A",
  "training_config": {
    "batch_size": 256,
    "num_training_steps": 397000
  },
  "notes": "ProWAM: World Action Modeling with Progressive Visual Planning. A 5B world action model that predicts an ordered chain of sparse sub-goals indexed by a normalized task-progress coordinate, then conditions action prediction on that chain. Sub-goals share the video backbone and are distinguished by a progress-conditioned adaLN offset; the video branch never attends to action tokens, so one cached video-expert pass serves every action denoising step. Evaluated with K=6 sub-goals at progress 0.3/0.4/0.5/0.65/0.8/0.9, action horizon 32, replan every 32 steps, 10 denoising steps, 50 official target tasks."
}
