{
    "model_name": "GR00T N1.5",
    "submitter": "RoboCasa Team",
    "model_type": "VLA",
    "date": "2026-05-19",
    "robocasa_version": "1.0.1",
    "atomic_seen_success": 50.7,
    "composite_seen_success": 14.8,
    "composite_unseen_success": 2.7,
    "code_url": "https://github.com/robocasa-benchmark/Isaac-GR00T",
    "commit_hash": "9d7d7a9eb7ad30bd8ce30448d9ab53a918b45b10",
    "checkpoint_url": "https://huggingface.co/robocasa/robocasa365_checkpoints/tree/main/gr00t_n1-5/multitask_learning/checkpoint-120000",
    "paper_link": "https://arxiv.org/abs/2503.14734",
    "open_source": "yes",
    "training_config": {
        "batch_size": 128,
        "num_training_steps": 120000
    },
    "notes": "re-evaluated with 1.5x longer horizon after RoboCasa 1.0.1 update for consistency"
  }
