{
  "model_name": "GR00T N1.6",
  "model_type": "VLA",
  "submitter": "RoboCasa Team",
  "date": "2026-05-14",
  "robocasa_version": "1.0.1",
  "atomic_seen_success": 51.1,
  "composite_seen_success": 9.4,
  "composite_unseen_success": 1.7,
  "code_url": "https://github.com/Abhiram824/grootn16",
  "commit_hash": "a21fc9af9a93a0b87bee534083b82d8f0b47d733",
  "checkpoint_url": "https://huggingface.co/Abhi03/grootn16_robocasa365_multitask_learning/tree/main/checkpoint-120000",
  "paper_link": "https://arxiv.org/abs/2503.14734",
  "open_source": "yes",
  "training_config": {
      "batch_size": 128,
      "num_training_steps": 120000
  },
  "notes": "<optional free text>"
}
