{
    "model_name": "π0.5",
    "submitter": "RoboCasa Team",
    "model_type": "VLA",
    "date": "2026-04-02",
    "robocasa_version": "1.0.0",
    "atomic_seen_success": 39.6,
    "composite_seen_success": 7.1,
    "composite_unseen_success": 1.2,
    "code_url": "https://github.com/robocasa-benchmark/openpi",
    "commit_hash": "ca4c6d710db75e276bc7c866a57bd7e4aee5b6e8",
    "checkpoint_url": "https://huggingface.co/robocasa/robocasa365_checkpoints/tree/main/pi05_pretrain_human300/multitask_learning/75000",
    "paper_link": "https://arxiv.org/abs/2504.16054",
    "open_source": "yes",
    "wandb": "https://wandb.ai/snasiriany/openpi/runs/9geuchwa?nw=nwusersnasiriany",
    "training_config": {
        "batch_size": 64,
        "num_training_steps": 75000
    },
    "notes": "Example submission file."
  }