{
  "model_name": "Xiaomi-Robotics-1",
  "model_type": "VLA",
  "submitter": "Xiaomi Robotics",
  "date": "2026-07-08",
  "robocasa_version": "1.0.1",
  "atomic_seen_success": 80.2,
  "composite_seen_success": 57.1, 
  "composite_unseen_success": 32.1,
  "code_url": "https://github.com/XiaomiRobotics/Xiaomi-Robotics-1/tree/main/eval_robocasa365",
  "commit_hash": "4da1db0a4deefa6de7ebb4ef0b8754017290f5f7",
  "checkpoint_url": "https://huggingface.co/XiaomiRobotics/Xiaomi-Robotics-1-RoboCasa365/tree/main",
  "paper_link": "https://arxiv.org/abs/2607.15330",
  "open_source": "yes",
  "wandb": "N/A",
  "training_config": {
    "batch_size": 512,
    "num_training_steps": 120000
  },
  "notes": "Results of Xiaomi-Robotics-1. Evaluated by RoboCasa team with private access to model weights and code."
}
