{
  "model_name": "Axiom-0",
  "submitter": "4Axiom Robotics",
  "model_type": "VLA",
  "date": "2026-10-01",
  "robocasa_version": "1.0.1",
  "atomic_seen_success": 86.5,
  "composite_seen_success": 59.4,
  "composite_unseen_success": 35.8,
  "code_url": "N/A",
  "commit_hash": "N/A",
  "checkpoint_url": "N/A",
  "paper_link": "http://arxiv.org/abs/2610.14155",
  "open_source": "no",
  "wandb": "N/A",
  "training_config": {
    "batch_size": 2048,
    "num_training_steps": 30000
  },
  "notes": "Results of Axiom-Robocasa365. This model is a full fine-tune of Xiaomi-Robotics-1 with added self-refinement modules."
}
